{
  "$schema": "https://json-schema.org/draft/2020-12/schema",
  "$id": "https://local.invalid/job-search-coach/private-recruiter-reply-triage-v1.schema.json",
  "title": "Private Recruiter Reply Triage v1",
  "type": "object",
  "additionalProperties": false,
  "required": ["schema_version", "artifact_kind", "locale", "state", "classification", "safe_context", "facts", "question", "blocked_claims", "handoff_allowed", "next_safe_action", "delivery"],
  "properties": {
    "schema_version": {"const": "private-recruiter-reply-triage-v1"},
    "artifact_kind": {"const": "private_recruiter_reply_triage"},
    "locale": {"enum": ["es", "en"]},
    "state": {"enum": ["clarify_first", "ready_for_private_prep", "stop"]},
    "classification": {"enum": ["screen_invite", "request_for_proof", "eligibility_question", "compensation_question", "decline", "unknown"]},
    "safe_context": {"$ref": "#/$defs/safe_context"},
    "facts": {"type": "array", "minItems": 1, "maxItems": 1, "items": {"$ref": "#/$defs/fact"}},
    "question": {"$ref": "#/$defs/question"},
    "blocked_claims": {"type": "array", "minItems": 1, "maxItems": 4, "uniqueItems": true, "items": {"allOf": [{"$ref": "#/$defs/prose_control_guard"}, {"type": "string", "minLength": 1, "maxLength": 280}]}},
    "handoff_allowed": {"type": "boolean"},
    "next_safe_action": {"enum": ["clarify_context_before_private_prep", "manual_reenter_private_prep", "record_stop_decision"]},
    "handoff": {"$ref": "#/$defs/handoff"},
    "delivery": {"$ref": "#/$defs/delivery"}
  },
  "allOf": [
    {
      "if": {"properties": {"state": {"const": "ready_for_private_prep"}}, "required": ["state"]},
      "then": {
        "required": ["handoff"],
        "properties": {
          "safe_context": {"properties": {"stage": {"const": "recruiter_screen"}, "role_context": {"const": "confirmed"}, "critical_constraints": {"const": "confirmed"}}},
          "facts": {"items": {"properties": {"state": {"const": "verified"}}, "required": ["state"]}},
          "question": {"required": ["kind"]},
          "handoff_allowed": {"const": true},
          "next_safe_action": {"const": "manual_reenter_private_prep"}
        }
      }
    },
    {
      "if": {"properties": {"state": {"const": "clarify_first"}}, "required": ["state"]},
      "then": {"properties": {"handoff_allowed": {"const": false}, "handoff": {"not": {}}, "next_safe_action": {"const": "clarify_context_before_private_prep"}}}
    },
    {
      "if": {"properties": {"state": {"const": "stop"}}, "required": ["state"]},
      "then": {"properties": {"handoff_allowed": {"const": false}, "handoff": {"not": {}}, "next_safe_action": {"const": "record_stop_decision"}}}
    },
    {
      "if": {"properties": {"state": {"const": "ready_for_private_prep"}, "classification": {"const": "decline"}}, "required": ["state", "classification"]},
      "then": {"not": {}}
    },
    {
      "if": {"properties": {"facts": {"contains": {"properties": {"state": {"const": "candidate_reported"}}, "required": ["state"]}}}, "required": ["facts"]},
      "then": {
        "anyOf": [
          {"properties": {"state": {"const": "clarify_first"}}, "required": ["state"]},
          {"properties": {"handoff_allowed": {"const": false}}, "required": ["handoff_allowed"]}
        ]
      }
    },
    {
      "if": {"properties": {"classification": {"const": "screen_invite"}}, "required": ["classification"]},
      "then": {"properties": {"question": {"properties": {"kind": {"const": "screen_opening"}}}}}
    },
    {
      "if": {"properties": {"classification": {"const": "request_for_proof"}}, "required": ["classification"]},
      "then": {"properties": {"question": {"properties": {"kind": {"const": "proof_example"}}}}}
    },
    {
      "if": {"properties": {"classification": {"const": "eligibility_question"}}, "required": ["classification"]},
      "then": {"properties": {"question": {"properties": {"kind": {"const": "eligibility_boundary"}}}}}
    },
    {
      "if": {"properties": {"classification": {"const": "compensation_question"}}, "required": ["classification"]},
      "then": {"properties": {"question": {"properties": {"kind": {"const": "compensation_boundary"}}}}}
    },
    {
      "if": {"properties": {"classification": {"const": "unknown"}}, "required": ["classification"]},
      "then": {"properties": {"question": {"properties": {"kind": {"const": "missing_detail"}}}}}
    }
  ],
  "$defs": {
    "prose_control_guard": {"type": "string", "allOf": [{"not": {"pattern": ".*[\u0000-\u001f\u007f-\u009f\u00ad\u0600-\u0605\u061c\u06dd\u070f\u0890-\u0891\u08e2\u180e\u200b-\u200f\u202a-\u202e\u2060-\u2064\u2066-\u206f\ufeff\ufff9-\ufffb\ud804\udcbd\ud804\udccd\ud80d\udc30\ud80d\udc31\ud80d\udc32\ud80d\udc33\ud80d\udc34\ud80d\udc35\ud80d\udc36\ud80d\udc37\ud80d\udc38\ud80d\udc39\ud80d\udc3a\ud80d\udc3b\ud80d\udc3c\ud80d\udc3d\ud80d\udc3e\ud80d\udc3f\ud82f\udca0\ud82f\udca1\ud82f\udca2\ud82f\udca3\ud834\udd73\ud834\udd74\ud834\udd75\ud834\udd76\ud834\udd77\ud834\udd78\ud834\udd79\ud834\udd7a\udb40\udc01\udb40\udc20\udb40\udc21\udb40\udc22\udb40\udc23\udb40\udc24\udb40\udc25\udb40\udc26\udb40\udc27\udb40\udc28\udb40\udc29\udb40\udc2a\udb40\udc2b\udb40\udc2c\udb40\udc2d\udb40\udc2e\udb40\udc2f\udb40\udc30\udb40\udc31\udb40\udc32\udb40\udc33\udb40\udc34\udb40\udc35\udb40\udc36\udb40\udc37\udb40\udc38\udb40\udc39\udb40\udc3a\udb40\udc3b\udb40\udc3c\udb40\udc3d\udb40\udc3e\udb40\udc3f\udb40\udc40\udb40\udc41\udb40\udc42\udb40\udc43\udb40\udc44\udb40\udc45\udb40\udc46\udb40\udc47\udb40\udc48\udb40\udc49\udb40\udc4a\udb40\udc4b\udb40\udc4c\udb40\udc4d\udb40\udc4e\udb40\udc4f\udb40\udc50\udb40\udc51\udb40\udc52\udb40\udc53\udb40\udc54\udb40\udc55\udb40\udc56\udb40\udc57\udb40\udc58\udb40\udc59\udb40\udc5a\udb40\udc5b\udb40\udc5c\udb40\udc5d\udb40\udc5e\udb40\udc5f\udb40\udc60\udb40\udc61\udb40\udc62\udb40\udc63\udb40\udc64\udb40\udc65\udb40\udc66\udb40\udc67\udb40\udc68\udb40\udc69\udb40\udc6a\udb40\udc6b\udb40\udc6c\udb40\udc6d\udb40\udc6e\udb40\udc6f\udb40\udc70\udb40\udc71\udb40\udc72\udb40\udc73\udb40\udc74\udb40\udc75\udb40\udc76\udb40\udc77\udb40\udc78\udb40\udc79\udb40\udc7a\udb40\udc7b\udb40\udc7c\udb40\udc7d\udb40\udc7e\udb40\udc7f].*"}}]},
    "safe_context": {
      "type": "object",
      "additionalProperties": false,
      "required": ["stage", "role_context", "critical_constraints", "summary"],
      "properties": {
        "stage": {"enum": ["recruiter_screen", "unknown", "not_applicable"]},
        "role_context": {"enum": ["confirmed", "missing", "not_applicable"]},
        "critical_constraints": {"enum": ["confirmed", "missing", "not_applicable"]},
        "summary": {"allOf": [{"$ref": "#/$defs/prose_control_guard"}, {"type": "string", "minLength": 1, "maxLength": 280}]}
      }
    },
    "fact": {
      "type": "object",
      "additionalProperties": false,
      "required": ["id", "state", "summary"],
      "properties": {
        "id": {"type": "string", "pattern": "^F-[0-9]{3}$"},
        "state": {"enum": ["verified", "candidate_reported"]},
        "summary": {"allOf": [{"$ref": "#/$defs/prose_control_guard"}, {"type": "string", "minLength": 1, "maxLength": 500}]}
      }
    },
    "question": {
      "type": "object",
      "additionalProperties": false,
        "required": ["id", "text", "fact_ids"],
        "properties": {
          "id": {"type": "string", "pattern": "^Q-[0-9]{3}$"},
          "text": {"allOf": [{"$ref": "#/$defs/prose_control_guard"}, {"type": "string", "minLength": 1, "maxLength": 500}]},
          "kind": {"enum": ["screen_opening", "proof_example", "eligibility_boundary", "compensation_boundary", "missing_detail"]},
          "fact_ids": {"type": "array", "minItems": 1, "maxItems": 1, "uniqueItems": true, "items": {"type": "string", "pattern": "^F-[0-9]{3}$"}}
      }
    },
    "delivery": {
      "type": "object",
      "additionalProperties": false,
      "required": ["draft_only", "external_actions_authorized", "no_calendar_action", "raw_reply_retained", "local_save_mode"],
      "properties": {
        "draft_only": {"const": true},
        "external_actions_authorized": {"const": false},
        "no_calendar_action": {"const": true},
        "raw_reply_retained": {"const": false},
        "local_save_mode": {"const": "disabled"}
      }
    },
    "handoff": {
      "type": "object",
      "additionalProperties": false,
      "required": ["module", "scope", "input_mode", "auto_start", "external_actions", "raw_reply_retained", "local_save_mode", "packet", "reentry_packet"],
      "properties": {
        "module": {"const": "prepare-role-interviews"},
        "scope": {"const": "one recruiter-screen question"},
        "input_mode": {"const": "identity_free_summary_plus_verified_fact"},
        "auto_start": {"const": false},
        "external_actions": {"const": false},
        "raw_reply_retained": {"const": false},
        "local_save_mode": {"const": "disabled"},
        "packet": {"$ref": "#/$defs/handoff_packet"},
        "reentry_packet": {"$ref": "#/$defs/reentry_packet"}
      }
    },
    "handoff_packet": {
      "type": "object",
      "additionalProperties": false,
      "required": ["context_summary", "source_snapshot", "fact_id", "question_id", "prep_scope"],
      "properties": {
        "context_summary": {"allOf": [{"$ref": "#/$defs/prose_control_guard"}, {"type": "string", "minLength": 1, "maxLength": 280}]},
        "source_snapshot": {"type": "string", "pattern": "^snap-triage-[0-9]{3}$"},
        "fact_id": {"type": "string", "pattern": "^F-[0-9]{3}$"},
        "question_id": {"type": "string", "pattern": "^Q-[0-9]{3}$"},
        "prep_scope": {"enum": ["screen_opening", "proof_example", "eligibility_boundary", "compensation_boundary", "missing_detail"]}
      }
    },
    "reentry_packet": {
      "type": "object",
      "additionalProperties": false,
      "required": ["schema_version", "source_artifact_kind", "context_summary", "source_snapshot", "fact_id", "question_id", "prep_scope", "manual_reentry_required", "candidate_answer_state", "score_state"],
      "properties": {
        "schema_version": {"const": "private-recruiter-screen-reentry-v1"},
        "source_artifact_kind": {"const": "private_recruiter_reply_triage"},
        "context_summary": {"allOf": [{"$ref": "#/$defs/prose_control_guard"}, {"type": "string", "minLength": 1, "maxLength": 280}]},
        "source_snapshot": {"type": "string", "pattern": "^snap-triage-[0-9]{3}$"},
        "fact_id": {"type": "string", "pattern": "^F-[0-9]{3}$"},
        "question_id": {"type": "string", "pattern": "^Q-[0-9]{3}$"},
        "prep_scope": {"enum": ["screen_opening", "proof_example", "eligibility_boundary", "compensation_boundary", "missing_detail"]},
        "manual_reentry_required": {"const": true},
        "candidate_answer_state": {"const": "unanswered"},
        "score_state": {"const": "unknown"}
      }
    }
  }
}
